uuid,Void/Retire,Fully specified name:en,Short name:en,Description:en,Data class,Data type,Answers,Members,Mappings|SAME-AS|PIH|Number,Mappings|SAME-AS|CIEL,Mappings|NARROWER-THAN|CIEL,Mappings|BROADER-THAN|CIEL,Mappings|SAME-AS|AMPATH,Mappings|NARROWER-THAN|AMPATH,Mappings|SAME-AS|ICD-10-WHO,Mappings|NARROWER-THAN|ICD-10-WHO,Mappings|BROADER-THAN|ICD-10-WHO,Mappings|SAME-AS|ICD-11-WHO,Mappings|NARROWER-THAN|ICD-11-WHO,Mappings|SAME-AS|LOINC,Mappings|NARROWER-THAN|LOINC,Mappings|BROADER-THAN|LOINC,Mappings|SAME-AS|org.openmrs.module.emrapi,Mappings|SAME-AS|RxNORM,Mappings|SAME-AS|SNOMED CT,Absolute high,Critical high,Normal high,Absolute low,Critical low,Normal low,Units,Display precision,Allow decimals,Complex data handler
163644AAAAAAAAAAAAAAAAAAAAAAAAAAAAAA,,Triple phosphate crystals,,"Crystals found in urine with a ""coffin-lid"" shaped appearance. They are composed of magnesium ammonium phosphate.",Finding,N/A,,,,,,,,,,,,,,,,46137-6,,,,,,,,,,,,,
163643AAAAAAAAAAAAAAAAAAAAAAAAAAAAAA,,Amorphous urate crystals in urine,,Type of crystals found in urine. This occurs when level of uric acid is elevated in blood causing increased excretion in the urine.,Finding,N/A,,,,,,,,,,,,,,,,12454-5,,,,,,,,,,,,,
163642AAAAAAAAAAAAAAAAAAAAAAAAAAAAAA,,Ammonium urate crystals in urine,,The presence of ammonium urate crystals in urine specimen.,Finding,N/A,,,,,,,,,,,,,,,,5766-1,,,,,,,,,,,,,
163640AAAAAAAAAAAAAAAAAAAAAAAAAAAAAA,,Appearance of stool,,Visual inspection of feces.,Finding,Coded,,,,,,,,,,,,,,,,29636-8,,,,,,,,,,,,,
163603AAAAAAAAAAAAAAAAAAAAAAAAAAAAAA,,Stool culture (bacterial),,Bacterial culture of stool.,Test,Text,,,,,,,,,,,,,,,,625-4,,,,,,,,,,,,,
163594AAAAAAAAAAAAAAAAAAAAAAAAAAAAAA,,Glucose tolerance test pre-glucose administration,,"Lab test that measures the body's ability to use glucose. This is the first of 5 samples, prior to drinking the bottle of glucose solution.",Test,Numeric,,,,,,,,,,,,,,,,,,,,450,,120,20,,70,mg/dl,,0,
163426AAAAAAAAAAAAAAAAAAAAAAAAAAAAAA,,"Combined % of monocytes, eosinophils and basophils",Mixed %,"A lab test obtained by summing the monocytes, eosinophils and basophils.",Test,Numeric,,,,,,,,,,,,,,,,,,,,50,,10,0,,1,%,,0,
162104AAAAAAAAAAAAAAAAAAAAAAAAAAAAAA,,Urine appears turbid,,,Finding,N/A,,,,,,,,,,,,,,,,,,,,,,,,,,,,,
162103AAAAAAAAAAAAAAAAAAAAAAAAAAAAAA,,Cloudy urine,,,Finding,N/A,,,,,,,,,,,,,,,,,,,,,,,,,,,,,
162102AAAAAAAAAAAAAAAAAAAAAAAAAAAAAA,,Urine appears clear,,,Finding,N/A,,,,,,,,,,,,,,,,,,,,,,,,,,,,,
162101AAAAAAAAAAAAAAAAAAAAAAAAAAAAAA,,Urine turbidity,,,Finding,Coded,Urine appears clear;Cloudy urine;Urine appears turbid,,,,,,,,,,,,,,,,,,,,,,,,,,,,
162100AAAAAAAAAAAAAAAAAAAAAAAAAAAAAA,,Brown color,,,Misc,N/A,,,,,,,,,,,,,,,,,,,,,,,,,,,,,
162065AAAAAAAAAAAAAAAAAAAAAAAAAAAAAA,,Black color,Black,,Misc,N/A,,,,,,,,,,,,,,,,,,,,,,,,,,,,,
127133AAAAAAAAAAAAAAAAAAAAAAAAAAAAAA,,Schistosoma Mansonii Infection,,A species of trematode blood flukes of the family Schistosomatidae. It is common in the Nile delta. The intermediate host is the planorbid snail. This parasite causes schistosomiasis mansoni and intestinal bilharziasis.,Diagnosis,N/A,,,,,,,,,,,,,,,,,,,,,,,,,,,,,
161511AAAAAAAAAAAAAAAAAAAAAAAAAAAAAA,,Serum ferritin,,,Test,Numeric,,,,,,,,,,,,,,,,,,,,,,,0,,,ng/ml,,1,
161505AAAAAAAAAAAAAAAAAAAAAAAAAAAAAA,,Thyroid stimulating hormone test,TSH test,,Test,Numeric,,,,,,,,,,,,,,,,,,,,,,,0,,,mcg/L,,1,
161485AAAAAAAAAAAAAAAAAAAAAAAAAAAAAA,,Body fluid culture and sensitivity,Body fluid C/S,,Test,Text,,,,,,,,,,,,,,,,,,,,,,,,,,,,,
161484AAAAAAAAAAAAAAAAAAAAAAAAAAAAAA,,Pus culture and sensitivity,Pus C/S,,Test,Text,,,,,,,,,,,,,,,,,,,,,,,,,,,,,
161450AAAAAAAAAAAAAAAAAAAAAAAAAAAAAA,,"Stool fat test, semi-quantitative",,,Test,Coded,Four plus;Two plus;Trace;Negative;Three plus;One plus,,,,,,,,,,,,,,,,,,,,,,,,,,,,
161449AAAAAAAAAAAAAAAAAAAAAAAAAAAAAA,,Stool test for reducing substance,,,Test,Coded,Negative;Positive,,,,,,,,,,,,,,,,,,,,,,,,,,,,
161448AAAAAAAAAAAAAAAAAAAAAAAAAAAAAA,,Kinyoun's stain for coccidians,,One of the techniques to stain acid fast organisms including Coccidians,Test,Text,,,,,,,,,,,,,,,,,,,,,,,,,,,,,
161155AAAAAAAAAAAAAAAAAAAAAAAAAAAAAA,,"Culture and sensitivity, blood",,"This is the procedure where the blood sample is incubated in different media to grow and isolate micro-organisms. After the growth of a micro-organism, its sensitivity to different antibiotics is also tested.",Test,Text,,,,,,,,,,,,,,,,,,,,,,,,,,,,,
161132AAAAAAAAAAAAAAAAAAAAAAAAAAAAAA,,Glomerular filtration rate,GFR,"The rate of fluid filtration from the glomerular capillaries to the Bowman's capsule, derived with the help of nuclear scan",Test,Numeric,,,,,,,,,,,,,,,,,,,,,,,0,,,ml/min/1.73m2,,1,
160914AAAAAAAAAAAAAAAAAAAAAAAAAAAAAA,,Post-prandial blood glucose measurement (mg/dL),PPBS,,Test,Numeric,,,,,,,,,,,,,,,,16915-1,,,,,,,0,,,mg/dL,,1,
160913AAAAAAAAAAAAAAAAAAAAAAAAAAAAAA,,Prostate specific antigen (PSA) measurement (ng/mL),PSA measurement,,Test,Numeric,,,,,,,,,,,,,,,,2857-1,,,,,,,0,,,ng/mL,,1,
160912AAAAAAAAAAAAAAAAAAAAAAAAAAAAAA,,Fasting blood glucose measurement (mg/dL),,,Test,Numeric,,,,,,,,,,,,,,,,1558-6,,,,,,,0,,,mg/dL,,1,
160910AAAAAAAAAAAAAAAAAAAAAAAAAAAAAA,,Yellow color,,Qualifier as a yellow color,Misc,N/A,,,,,,,,,,,,,,,,,,,,,,,,,,,,,
160909AAAAAAAAAAAAAAAAAAAAAAAAAAAAAA,,Green color,,Qualifier as a green color,Misc,N/A,,,,,,,,,,,,,,,,,,,,,,,,,,,,,
160735AAAAAAAAAAAAAAAAAAAAAAAAAAAAAA,,"Bacteriuria test, urine",,Test for bacteria in urine. Can be done by dipstick or microscopic methods.,Test,Coded,Positive;Negative;Not done;Unknown;Indeterminate,,,,,,,,,,,,,,,,,,,,,,,,,,,,
159825AAAAAAAAAAAAAAAAAAAAAAAAAAAAAA,,"uric acid, serum",,,Test,Numeric,,,,,,,,6134,,,,,,,,,,,,,,8.3,,,3.6,mg/dL,,1,
159664AAAAAAAAAAAAAAAAAAAAAAAAAAAAAA,,gram-negative cocci,gram-negative coccus,Type of bacteria that does not stain with gram stain.,Misc,N/A,,,,,,,,1989,,,,,,,,,,,,,,,,,,,,,
159663AAAAAAAAAAAAAAAAAAAAAAAAAAAAAA,,gram-positive cocci,gram-positive coccus,Type of bacteria that stains positive with gram stain.,Misc,N/A,,,,,,,,1988,,,,,,,,,,,,,,,,,,,,,
159644AAAAAAAAAAAAAAAAAAAAAAAAAAAAAA,,Glycosylated hemoglobin A measurement,HbA1c,Glycosylated hemoglobin A (HbA1c) test is measured in percent and is gives an indication of average serum glucose levels over several months.,Test,Numeric,,,,,,,,6126,,,,,,,,,,,,,,,0,,,%,,1,
159416AAAAAAAAAAAAAAAAAAAAAAAAAAAAAA,,Rarely,,"Frequency of findings, rarely.",Misc,N/A,,,,,,,,,,,,,,,,,,,,,,,,,,,,,
163693AAAAAAAAAAAAAAAAAAAAAAAAAAAAAA,,WBC casts presence in urine sediment by light microscopy test,,A lab test used to determine the presence of WBC (leukocyte) casts in urine specimen using a light microscope.,Test,Coded,Two plus;Rarely;Three plus;Negative;One plus,,,,,,,,,,,,,,,,,,,,,,,,,,,,
163692AAAAAAAAAAAAAAAAAAAAAAAAAAAAAA,,Epithelial casts presence in urine sediment by light microscopy test,,A lab test used to determine the presence of epithelial casts in urine specimen using a light microscope.,Test,Coded,Two plus;Rarely;Three plus;Negative;One plus,,,,,,,,,,,,,,,25157-9,,,,,,,,,,,,,
163691AAAAAAAAAAAAAAAAAAAAAAAAAAAAAA,,Fatty casts presence in urine sediment by light microscopy test,,A lab test used to determine the presence of fatty casts in urine specimen using a light microscope.,Test,Coded,Two plus;Rarely;Three plus;Negative;One plus,,,,,,,,,,,,,,,25159-5,,,,,,,,,,,,,
163690AAAAAAAAAAAAAAAAAAAAAAAAAAAAAA,,Granular casts presence in urine sediment by light microscopy test,,A lab test used to determine the presence of granular casts in urine specimen using a light microscope.,Test,Coded,Two plus;Rarely;Three plus;Negative;One plus,,,,,,,,,,,,,,,25160-3,,,,,,,,,,,,,
163688AAAAAAAAAAAAAAAAAAAAAAAAAAAAAA,,Spore presence in urine test,,A lab test used to determine the presence of fungal spores in urine specimen using a light microscope.,Test,Coded,Two plus;Rarely;Three plus;Negative;One plus,,,,,,,,,,,,,,,,,,,,,,,,,,,,
163687AAAAAAAAAAAAAAAAAAAAAAAAAAAAAA,,Yeast hyphae presence in urine sediment by light microscopy test,,A lab test to identify the presence of hyphae yeast in urine using a light microscope.,Test,Coded,Two plus;Rarely;Three plus;Negative;One plus,,,,,,,,,,,,,,,41865-7,,,,,,,,,,,,,
163686AAAAAAAAAAAAAAAAAAAAAAAAAAAAAA,,Yeast presence in urine sediment by light microscopy,,A lab test to identify the presence of yeast cells in the urine using a light microscope.,Test,Coded,Two plus;Rarely;Three plus;Negative;One plus,,,,,,,,,,,,,,,32356-8,,,,,,,,,,,,,
159362AAAAAAAAAAAAAAAAAAAAAAAAAAAAAA,,Fecal occult blood test,FOBT,"Stool guaiac, hemoccult, peroxidase test for occult blood in stool",Test,Coded,Indeterminate;Negative;Positive,,,,,,,,,,,,,,,,,,,,,,,,,,,,
123505AAAAAAAAAAAAAAAAAAAAAAAAAAAAAA,,Uric Acid Crystalluria,,,Diagnosis,N/A,,,,,,,,,,R82.9,,,,,,,,,,,,,,,,,,,
123501AAAAAAAAAAAAAAAAAAAAAAAAAAAAAA,,"Urinary Cast, Hyaline",,,Diagnosis,N/A,,,,,,,,,,R82.9,,,,,,,,,,,,,,,,,,,
163695AAAAAAAAAAAAAAAAAAAAAAAAAAAAAA,,Crystals type in urine sediment by light microscopy test,,A lab test used to determine the presence of crystals in urine specimen using a light microscope.,Test,Coded,"Amorphous phosphate crystals;Ammonium urate crystals in urine;High;Amorphous urate crystals in urine;Moderate;Calcium phosphate;None;Magnesium phosphate;Uric Acid Crystalluria;Urinary Cast, Hyaline;Calcium sulfate;Few;Calcium oxalate crystals;Cystine;Triple phosphate crystals",,,,,,,,,,,,,,,5782-8,,,,,,,,,,,,,
1231AAAAAAAAAAAAAAAAAAAAAAAAAAAAAAAA,,Ab negative,,"Describes a particular antigen combination on the surface of red blood cells: AB, Rh negative.",Misc,N/A,,,,,,,,,,,,,,,,,,,,,,,,,,,,,
1230AAAAAAAAAAAAAAAAAAAAAAAAAAAAAAAA,,Ab positive,,"Describes a particular antigen combination on the surface of red blood cells: AB, Rh positive.",Misc,N/A,,,,,,,,,,,,,,,,,,,,,,,,,,,,,
300AAAAAAAAAAAAAAAAAAAAAAAAAAAAAAAAA,,Blood typing,,"Blood typing tests are done before a person receives a blood transfusion and to check a pregnant woman's blood type. Human blood is classified, or typed, according to the presence or absence of certain markers (called antigens) on the surface of red blood cells.",Test,Coded,A positive;A negative;B positive;B negative;O positive;O negative;Ab positive;Ab negative,,,,,,,,,,,,,,,,,,,,,,,,,,,,
120759AAAAAAAAAAAAAAAAAAAAAAAAAAAAAA,,Cestode Infection,,A subclass of segmented worms comprising the tapeworms.,Diagnosis,N/A,,,,,,,,,,B71.9,,,,,,,,,,,,,,,,,,,
148882AAAAAAAAAAAAAAAAAAAAAAAAAAAAAA,,Ancylostomiasis due to Ancylostoma Duodenale,,"A genus of nematode intestinal parasites that consists of several species. A. duodenale is the common hookworm in humans. A. braziliense, A. ceylonicum, and A. caninum occur primarily in cats and dogs, but all have been known to occur in humans.",Diagnosis,N/A,,,,,,,,,,B76.9,,,,,,,,,,,,,,,,,,,
304AAAAAAAAAAAAAAAAAAAAAAAAAAAAAAAAA,,Stool exam,,"Evaluation of stool under a microscope, usually for ova and parasites.",Test,Coded,Cestode Infection;Infection by Ascaris Lumbricoides;Ancylostomiasis due to Ancylostoma Duodenale;Schistosoma Mansonii Infection;Other non-coded;Infection due to Entamoeba Histolytica,,,,,,,,,,,,,,,10704-5,,,,,,,,,,,,,
1077AAAAAAAAAAAAAAAAAAAAAAAAAAAAAAAA,,bloody,,Descriptive quality.,Misc,N/A,,,,,,,,,,,,,,,,,,,,,,,,,,,,,
163641AAAAAAAAAAAAAAAAAAAAAAAAAAAAAA,,Color of stool,,,Finding,Coded,Black color;Yellow color;bloody;Other non-coded;Brown color;Green color,,,,,,,,,,,,,,,9397-1,,,,,,,,,,,,,
1038AAAAAAAAAAAAAAAAAAAAAAAAAAAAAAAA,,"Neisseria gonorrhoeae polymerase chain reaction, qualitative",GC PCR qual,Qualitative test to detect gonococcal infections via PCR,Test,Coded,Positive;Negative;Equivocal;Poor sample quality,,,,,,,,,,,,,,,24111-7,,,,,,,,,,,,,
1458AAAAAAAAAAAAAAAAAAAAAAAAAAAAAAAA,,Serum glucose (mmol),Glu,,Test,Numeric,,,,,,,,,,,,,,,,,,,,,,,,,,mmol/L,,1,
1034AAAAAAAAAAAAAAAAAAAAAAAAAAAAAAAA,,"Chlamydia trachomatis polymerase chain reaction, qualitative",CT qual,Qualitative test to detect chlamydia infections via PCR,Test,Coded,Positive;Negative;Equivocal;Poor sample quality,,,,,,,,,,,,,,,21613-5,,,,,,,,,,,,,
1033AAAAAAAAAAAAAAAAAAAAAAAAAAAAAAAA,,Chlamydia trachomatis polymerase chain reaction,CT PCR,Test to detect chlamydial infections via PCR,Test,Numeric,,,,,,,,,,,,,,,,49096-1,,,,,,,0,,,copies/ml,,0,
1025AAAAAAAAAAAAAAAAAAAAAAAAAAAAAAAA,,Basophils,Basos,"Type of leukocyte, with coarse granules that stain blue when exposed to a basic dye. Basophils normally constitute 1% or less of the total white blood cell count but may increase or decrease in certain diseases.",Test,Numeric,,,,,,,,,,,,,,,,706-2,,,,100,,,0,,,%,,0,
1018AAAAAAAAAAAAAAAAAAAAAAAAAAAAAAAA,,Mean corpuscular hemoglobin,MCH,"A calculation of the amount of oxygen-carrying hemoglobin inside RBCs. Since macrocytic RBCs are larger than either normal or microcytic RBCs, they would also tend to have higher MCH values.",Test,Numeric,,,,,,,,,,,,,,,,28539-5,,,,,,34,0,,26,pg,,1,
1017AAAAAAAAAAAAAAAAAAAAAAAAAAAAAAAA,,Mean cell hemoglobin concentration,MCHC,Average concentration of hemoglobin in a given volume of blood.,Test,Numeric,,,,,,,,,,,,,,,,28540-3,,,,,,37,0,,33,g/dL,,1,
1016AAAAAAAAAAAAAAAAAAAAAAAAAAAAAAAA,,Red cell distribution width,RDW,Measurement of the amount that red blood cells vary in size,Test,Numeric,,,,,,,,,,,,,,,,30384-2,,,,,,20,0,,10,%,,1,
1011AAAAAAAAAAAAAAAAAAAAAAAAAAAAAAAA,,Creatine kinase,CK,Blood product of muscular cell damage,Test,Numeric,,,,,,,,,,,,,,,,2157-6,,,,,,174,0,,26,IU/L,,0,
b7fa6418-64d4-48f1-93cb-c69ef1eb3991,,Other faecal abnormalities,,,Code,N/A,,,,,,,,,,,,,,,,,,,,,,,,,,,,,
139041AAAAAAAAAAAAAAAAAAAAAAAAAAAAAA,,Helicobacter Pylori Gastrointestinal Tract Infection,,"A spiral bacterium active as a human gastric pathogen. It is a gram-negative, urease-positive, curved or slightly spiral organism initially isolated in 1982 from patients with lesions of gastritis or peptic ulcers in Western Australia. Helicobacter pylori was originally classified in the genus CAMPYLOBACTER, but RNA sequencing, cellular fatty acid profiles, growth patterns, and other taxonomic characteristics indicate that the micro-organism should be included in the genus HELICOBACTER. It has been officially transferred to Helicobacter gen. nov. (see Int J Syst Bacteriol 1989 Oct;39(4):297-405).",Diagnosis,N/A,,,,,,,,,,A04.8,,,,,,,,,,,,,,,,,,,
138609AAAAAAAAAAAAAAAAAAAAAAAAAAAAAA,,Hip Pain,,Pain in the joint.,Diagnosis,N/A,,,,,,,,,,M25.5,,,,,,,,,,,,,,,,,,,
130601AAAAAAAAAAAAAAAAAAAAAAAAAAAAAA,,Peptic Ulcer of Stomach,,,Diagnosis,N/A,,,,,,,,,,,K25.9,,,,,,,,,,,,,,,,,,
130595AAAAAAAAAAAAAAAAAAAAAAAAAAAAAA,,Peptic Ulcer with Perforation,,"Penetration of a peptic ulcer through the stomach wall. May be free, i.e., at a point where the stomach wall faces a real or potential space,, or confined, i.e., at a point where the stomach wall is defended by contiguous or adjacent structures, such as t",Diagnosis,N/A,,,,,,,,,,,,,,,,,,,,,,,,,,,,,
123919AAAAAAAAAAAAAAAAAAAAAAAAAAAAAA,,Ulcer,,"A lesion on the surface of the skin or a mucous surface, produced by the sloughing of inflammatory necrotic tissue.",Diagnosis,N/A,,,,,,,,593,,,L98.4,,,,,,,,,,,,,,,,,,
123569AAAAAAAAAAAAAAAAAAAAAAAAAAAAAA,,Upper Gastrointestinal Hemorrhage,,"Bleeding in the esophagus, stomach or duodenum parts of the gastrointestinal tract.",Diagnosis,N/A,,,,,,,,,,,,,,,,,,,,,,,,,,,,,
119481AAAAAAAAAAAAAAAAAAAAAAAAAAAAAA,,Diabetes mellitus,,A heterogeneous group of disorders that share glucose intolerance in common.,Diagnosis,Coded,No;Yes;Unknown,,,,,,,,,,,,5A14,,,,,,,,,,,,,,,,
117905AAAAAAAAAAAAAAAAAAAAAAAAAAAAAA,,Gastric ulcer,,,Diagnosis,N/A,,,,,,,,,,,K25.9,,,,,,,,,,,,,,,,,,
117903AAAAAAAAAAAAAAAAAAAAAAAAAAAAAA,,Bleeding Stomach Ulcer,,,Diagnosis,N/A,,,,,,,,,,,,,,,,,,,,,,,,,,,,,
149783AAAAAAAAAAAAAAAAAAAAAAAAAAAAAA,,Acute Gastric Ulcer without Hemorrhage or Perforation,,,Diagnosis,N/A,,,,,,,,,,,,,,,,,,,,,,,,,,,,,
149594AAAAAAAAAAAAAAAAAAAAAAAAAAAAAA,,Acute Peptic Ulcer with Haemorrhage but without Obstruction,,,Diagnosis,N/A,,,,,,,,,,K27.0,,,,,,,,,,,,,,,,,,,
149592AAAAAAAAAAAAAAAAAAAAAAAAAAAAAA,,Acute Peptic Ulcer with Perforation,,,Diagnosis,N/A,,,,,,,,,,,,,,,,,,,,,,,,,,,,,
145625AAAAAAAAAAAAAAAAAAAAAAAAAAAAAA,,Cholelithiasis,,,Diagnosis,N/A,,,,,,,,,,K80.8,,,,,,,,,,,,,,,,,,,
141210AAAAAAAAAAAAAAAAAAAAAAAAAAAAAA,,Enteropathogenic Escherichia Coli Gastrointestinal Tract Infection,,,Diagnosis,N/A,,,,,,,,,,,,,,,,,,,,,,,,,,,,,
141AAAAAAAAAAAAAAAAAAAAAAAAAAAAAAAAA,,Typhoid fever,,"An acute, highly infectious disease caused by a bacillus (Salmonella typhi) transmitted chiefly by contaminated food or water and characterized by high fever, headache, coughing, intestinal hemorrhaging, and rose-colored spots on the skin.",Diagnosis,N/A,,,,,,,,,,,,,,,,,,,,,,,,,,,,,
166845AAAAAAAAAAAAAAAAAAAAAAAAAAAAAA,,Multisystem inflammatory syndrome associated with severe acute respiratory syndrome coronavirus 2 (SARS-CoV-2) infection in adult,,,Diagnosis,N/A,,,,,,,,,,U10.9,,,RA03,,,,,,,,,,,,,,,,
165633AAAAAAAAAAAAAAAAAAAAAAAAAAAAAA,,Upper respiratory tract infection due to severe acute respiratory syndrome coronavirus 2 (SARS-CoV-2),,,Diagnosis,N/A,,,,,,,,,,J06.9,,,RA01.1/CA07.0&XN109,,,,,,,,,,,,,,,,
165630AAAAAAAAAAAAAAAAAAAAAAAAAAAAAA,,Acute respiratory disease due to severe acute respiratory syndrome coronavirus 2 (SARS-CoV-2),,,Diagnosis,N/A,,,,,,,,,,U07.1,,,RA01.1,,,,,,,,,,,,,,,,
165623AAAAAAAAAAAAAAAAAAAAAAAAAAAAAA,,Disease due to severe acute respiratory syndrome coronavirus 2 (SARS-CoV-2),,,Diagnosis,N/A,,,,,,,,,,U07.1,,,RA01.1,,,,,,,,,,,,,,,,
165612AAAAAAAAAAAAAAAAAAAAAAAAAAAAAA,,Suspected severe acute respiratory syndrome coronavirus 2 (SARS-CoV-2) infection,,,Diagnosis,N/A,,,,,,,,,,U07.2,,,RA01.1,,,,,,,,,,,,,,,,
165608AAAAAAAAAAAAAAAAAAAAAAAAAAAAAA,,Pneumonia due to severe acute respiratory syndrome coronavirus 2 (SARS-CoV-2),,,Diagnosis,N/A,,,,,,,,,,U07.1,,,RA01.1/CA40.1Y,,,,,,,,,,,,,,,,
130811AAAAAAAAAAAAAAAAAAAAAAAAAAAAAA,,Paratyphoid Fever,,A prolonged febrile illness commonly caused by serotypes of Salmonella paratyphi. It is similar to typhoid fever but less severe.,Diagnosis,N/A,,,,,,,,,,,,,,,,,,,,,,,,,,,,,
1293AAAAAAAAAAAAAAAAAAAAAAAAAAAAAAAA,,Gastroesophageal reflux disease,,"A chronic condition in which the lower esophageal sphincter allows gastric acids to reflux into the esophagus, causing heartburn, acid indigestion, and possible injury to the esophageal lining.",Diagnosis,N/A,,,,,,,,,,,,,,,,,,,,,,,,,,,,,
126558AAAAAAAAAAAAAAAAAAAAAAAAAAAAAA,,Shigellosis,,An infectious disease caused by bacteria of the genus SHIGELLA. This condition is characterized by intestinal pain and diarrhea.,Diagnosis,N/A,,,,,,,,,,A03.9,,,,,,,,,,,,,,,,,,,
122604AAAAAAAAAAAAAAAAAAAAAAAAAAAAAA,,Cholera due to Vibrio cholerae,,An acute diarrheal disease endemic in India and Southeast Asia whose causative agent is VIBRIO CHOLERAE. This condition can lead to severe dehydration in a matter of hours unless quickly treated.,Diagnosis,N/A,,,,,,,,198,,,,,,,,,,,,,,,,,,,,,
114262AAAAAAAAAAAAAAAAAAAAAAAAAAAAAA,,Peptic ulcer,,,Diagnosis,N/A,,,,,,,,,,,K27.9,,,,,,,,,,,,,,,,,,
1449AAAAAAAAAAAAAAAAAAAAAAAAAAAAAAAA,,Gestational diabetes,,DEF: Includes gestational impaired glucose tolerance and gestational diabetes mellitus. DESC: Glucose tolerance changes during pregnancy; two hours after 75G glucose: venous glusose >= 7.8 mmol/L but < 11.1 mmol/L means Impaired Glucose Tolerance; venous glucose >= 11.1 means Diabetes Mellitus. REF: Oxford Clinical Medicine.,Diagnosis,Boolean,,,,,,,,,,O24.4,,,JA63.2,,,,,,,,,,,,,,,,
142486AAAAAAAAAAAAAAAAAAAAAAAAAAAAAA,,Diabetes insipidus,,,Diagnosis,N/A,,,,,,,,,,,,,,,,,,,,,,,,,,,,,
141730AAAAAAAAAAAAAAAAAAAAAAAAAAAAAA,,Drug-Induced Diabetes Mellitus,,,Diagnosis,N/A,,,,,,,,,,E13.9,,,,,,,,,,,,,,,,,,,
140987AAAAAAAAAAAAAAAAAAAAAAAAAAAAAA,,Essential hypertension,,Persistently high arterial blood pressure. Currently accepted threshold levels are 140 mm Hg systolic and 90 mm Hg diastolic pressure.,Diagnosis,N/A,,,,,,,,,,,,,,,,,,,,,,,,,,,,,
138176AAAAAAAAAAAAAAAAAAAAAAAAAAAAAA,,Hyperthyroidism,,Excessive functional activity of the thyroid gland.,Diagnosis,N/A,,,,,,,,,,E05.5,,,,,,,,,,,,,,,,,,,
128125AAAAAAAAAAAAAAAAAAAAAAAAAAAAAA,,Pulmonary Hypertension,,"Increased pressure within the pulmonary circulation, usually secondary to cardiac or pulmonary disease.",Diagnosis,N/A,,,,,,,,,,,I27.0,,,,,,,,,,,,,,,,,,
122101AAAAAAAAAAAAAAAAAAAAAAAAAAAAAA,,Acute Cholecystitis,,Inflammation of the gallbladder.,Diagnosis,N/A,,,,,,,,,,,,,,,,,,,,,,,,,,,,,
117321AAAAAAAAAAAAAAAAAAAAAAAAAAAAAA,,Hypothyroidism,,,Diagnosis,N/A,,,,,,,,,,E03.9,,,,,,,,,,,,,,,,,,,
884AAAAAAAAAAAAAAAAAAAAAAAAAAAAAAAAA,,Human immunodeficiency virus,,The virus that causes the acquired immune deficiency syndrome (AIDS).,Organism,N/A,,,,,,,,,,,,,,,,,,,,,,,,,,,,,
165609AAAAAAAAAAAAAAAAAAAAAAAAAAAAAA,,Infection due to severe acute respiratory syndrome coronavirus 2 (SARS-CoV-2),,,Diagnosis,N/A,,,,,,,,,,U07.1,,,RA01.1,,,,,,,,,,,,,,,,
133328AAAAAAAAAAAAAAAAAAAAAAAAAAAAAA,,Neoplasm of Lung,,Tumors or cancer of the LUNG.,Diagnosis,N/A,,,,,,,,,,D38.6,,,,,,,,,,,,,,,,,,,
125119AAAAAAAAAAAAAAAAAAAAAAAAAAAAAA,,Syphilitic Cirrhosis,,Syphilis acquired in utero and manifested by any of several characteristic tooth (Hutchinson's teeth) or bone malformations and by active mucocutaneous syphilis at birth or shortly thereafter. Ocular and neurologic changes may also occur.,Diagnosis,N/A,,,,,,,,,,A52.7,,,,,,,,,,,,,,,,,,,
155010AAAAAAAAAAAAAAAAAAAAAAAAAAAAAA,,AIDS with Kaposi's sarcoma,,,Diagnosis,N/A,,,,,,,,,,,,,,,,,,,,,,,,,,,,,
116023AAAAAAAAAAAAAAAAAAAAAAAAAAAAAA,,Malignant neoplasm of cervix uteri,,Tumors or cancer of the uterine cervix.,Diagnosis,N/A,,,,,,,,,,,,,,,,,,,,,,,,,,,,,
146221AAAAAAAAAAAAAAAAAAAAAAAAAAAAAA,,Carcinoma of Prostate,,Tumors or cancer of the prostate.,Diagnosis,N/A,,,,,,,,,,C61,,,,,,,,,,,,,,,,,,,
129119AAAAAAAAAAAAAAAAAAAAAAAAAAAAAA,,Primary Genital Syphilis,,"The primary sore of syphilis, a painless indurated, eroded papule, occurring at the site of entry of the infection.",Diagnosis,N/A,,,,,,,,,,,,,,,,,,,,,,,,,,,,,
134561AAAAAAAAAAAAAAAAAAAAAAAAAAAAAA,,Measles,,"A highly contagious infectious disease caused by MORBILLIVIRUS, common among children but also seen in the nonimmune of any age, in which the virus enters the respiratory tract via droplet nuclei and multiplies in the epithelial cells, spreading throughout the reticuloendothelial system. (From Dorland, 27th ed)",Diagnosis,N/A,,,,,,,,,,,,,,,,,,,,,,,,,,,,,
116128AAAAAAAAAAAAAAAAAAAAAAAAAAAAAA,,Malaria,,"A protozoan disease caused by four species of the genus PLASMODIUM (P. falciparum (MALARIA, FALCIPARUM), P. vivax (MALARIA, VIVAX), P. ovale, and P. malariae) and transmitted by the bite of an infected female mosquito of the genus Anopheles. Malaria is endemic in parts of Asia, Africa, Central and South America, Oceania, and certain Caribbean islands. It is characterized by extreme exhaustion associated with paroxysms of high fever, sweating, shaking chills, and anemia.",Diagnosis,N/A,,,,,,,,,,,,,1F4Z,,,,,,,,,,,,,,,,
142943AAAAAAAAAAAAAAAAAAAAAAAAAAAAAA,,Dander (Animal) Allergy,,,Diagnosis,N/A,,,,,,,,,,J30.3,,,,,,,,,,,,,,,,,,,
140039AAAAAAAAAAAAAAAAAAAAAAAAAAAAAA,,Flushing,,"A transient reddening of the face that may be due to fever, certain drugs, exertion, stress, or a disease process.",Diagnosis,N/A,,,,,,,,,,,,,,,,,,,,,,,,,,,,,
139584AAAAAAAAAAAAAAAAAAAAAAAAAAAAAA,,Gastrointestinal Food Allergy,,,Diagnosis,N/A,,,,,,,,,,K52.2,,,,,,,,,,,,,,,,,,,
139581AAAAAAAAAAAAAAAAAAAAAAAAAAAAAA,,Gastrointestinal Irritation,,,Diagnosis,N/A,,,,,,,,,,,,,,,,,,,,,,,,,,,,,
71617AAAAAAAAAAAAAAAAAAAAAAAAAAAAAAA,,Acetylsalicylate sodium,,Name of a drug which is used as anti inflammatory and analgesic,Drug,N/A,,,,,,,,,,,,,,,,,,,,,,,,,,,,,
162548AAAAAAAAAAAAAAAAAAAAAAAAAAAAAA,,Strawberry,,,Misc,N/A,,,,,,,,,,,,,,,,,,,,,,,,,,,,,
162545AAAAAAAAAAAAAAAAAAAAAAAAAAAAAA,,Dairy products,,,Misc,N/A,,,,,,,,,,,,,,,,,,,,,,,,,,,,,
162543AAAAAAAAAAAAAAAAAAAAAAAAAAAAAA,,Beef,,Flesh of a cow,Misc,N/A,,,,,,,,,,,,,,,,,,,,,,,,,,,,,
162177AAAAAAAAAAAAAAAAAAAAAAAAAAAAAA,,Wheat,,,Misc,N/A,,,,,,,,,,,,,,,,,,,,,,,,,,,,,
162175AAAAAAAAAAAAAAAAAAAAAAAAAAAAAA,,Shellfish (dietary),,,Misc,N/A,,,,,,,,,,,,,,,,,,,,,,,,,,,,,
162172AAAAAAAAAAAAAAAAAAAAAAAAAAAAAA,,Peanuts,,A food often causing allergic reactions,Misc,N/A,,,,,,,,,,,,,,,,,,,,,,,,,,,,,
162171AAAAAAAAAAAAAAAAAAAAAAAAAAAAAA,,Eggs (edible),,,Misc,N/A,,,,,,,,,,,,,,,,,,,,,,,,,,,,,
160557AAAAAAAAAAAAAAAAAAAAAAAAAAAAAA,,No known allergies,NKA,,Question,Boolean,,,,,,,,,,,,,,,,,,,,,,,,,,,,,
159347AAAAAAAAAAAAAAAAAAAAAAAAAAAAAA,,Musculoskeletal pain,,,Diagnosis,N/A,,,,,,,,,,,,,,,,,,,,,,,,,,,,,
159098AAAAAAAAAAAAAAAAAAAAAAAAAAAAAA,,Toxic liver disease,,,Diagnosis,Coded,,,,,,,,,,,,,,,,,,,,,,,,,,,,,
156681AAAAAAAAAAAAAAAAAAAAAAAAAAAAAA,,house dust mite allergy,,,Diagnosis,N/A,,,,,,,,,,Z91.0,,,,,,,,,,,,,,,,,,,
156587AAAAAAAAAAAAAAAAAAAAAAAAAAAAAA,,heparin allergy,,,Diagnosis,N/A,,,,,,,,,,Z88.8,,,,,,,,,,,,,,,,,,,
121689AAAAAAAAAAAAAAAAAAAAAAAAAAAAAA,,Allergy,,,Diagnosis,N/A,,,,,,,,,,T78.4,,,,,,,,,,,,,,,,,,,
121684AAAAAAAAAAAAAAAAAAAAAAAAAAAAAA,,Personal History of Allergy to Anti-Infective Agent,,,Diagnosis,N/A,,,,,,,,,,Z88.3,,,,,,,,,,,,,,,,,,,
121677AAAAAAAAAAAAAAAAAAAAAAAAAAAAAA,,Altered Mental Status,,,Diagnosis,N/A,,,,,,,,,,,,,,,,,,,,,,,,,,,,,
121AAAAAAAAAAAAAAAAAAAAAAAAAAAAAAAAA,,Myalgia,,"Muscular pain or tenderness, especially when diffuse and nonspecific.",Finding,N/A,,,,,,,,,,,,,,,,,,,,,,,,,,,,,
155045AAAAAAAAAAAAAAAAAAAAAAAAAAAAAA,,allergy to sufentanil,,,Diagnosis,N/A,,,,,,,,,,Z88.5,,,,,,,,,,,,,,,,,,,
155044AAAAAAAAAAAAAAAAAAAAAAAAAAAAAA,,allergy to sevoflurane,,,Diagnosis,N/A,,,,,,,,,,Z88.4,,,,,,,,,,,,,,,,,,,
155043AAAAAAAAAAAAAAAAAAAAAAAAAAAAAA,,allergy to remifentanil,,,Diagnosis,N/A,,,,,,,,,,Z88.5,,,,,,,,,,,,,,,,,,,
155042AAAAAAAAAAAAAAAAAAAAAAAAAAAAAA,,allergy to meropenem,,,Diagnosis,N/A,,,,,,,,,,Z88.1,,,,,,,,,,,,,,,,,,,
